{
  "updated_at": "2026-04-07 18:16",
  "update_frequency": "Hafta ici her gun 10:01, 12:30, 17:00 ve 19:30'da otomatik guncellenir. Admin manuel olarak istedigi zaman yenileyebilir.",
  "total_stocks": 31,
  "signal_counts": {
    "STRONG_BUY": 0,
    "BUY": 2,
    "WEAK_BUY": 5,
    "HOLD": 20,
    "WEAK_SELL": 3,
    "SELL": 1,
    "STRONG_SELL": 0
  },
  "stocks": [
    {
      "ticker": "TKFEN",
      "name": "Tekfen Holding",
      "sector": "Holding",
      "price": 95.55,
      "change_pct": -2.7481,
      "rsi": 59.8163,
      "stoch_k": 64.2322,
      "adx": 57.8221,
      "volume_ratio": 0.9,
      "signal": "AL",
      "signal_en": "BUY",
      "score": 25.4,
      "confidence": 94.1,
      "color": "#00c853",
      "targets": {
        "target_1": 105.1,
        "target_2": 111.43,
        "target_3": 127.32,
        "stop_loss": 90.17,
        "add_level": 93.4
      },
      "range_3m": {
        "min": 67.0,
        "max": 105.1
      },
      "range_6m": {
        "min": 66.69,
        "max": 105.1
      },
      "explanation_short": "🟢 Günlük bazda ALIŞ sinyali veriyoruz. Alım sebepleri: HAFİF AL — Yükseliş trendi sürüyor ama momentum azalıyor. | AL — Tüm ortalamalar altında, mükemmel teknik görünüm. | HAFİF AL — Kısa vadeli topar"
    },
    {
      "ticker": "ASTOR",
      "name": "Astor Enerji",
      "sector": "Enerji",
      "price": 204.5,
      "change_pct": -2.7117,
      "rsi": 58.2031,
      "stoch_k": 69.7068,
      "adx": 34.8946,
      "volume_ratio": 0.6,
      "signal": "AL",
      "signal_en": "BUY",
      "score": 24.6,
      "confidence": 68.6,
      "color": "#00c853",
      "targets": {
        "target_1": 234.47,
        "target_2": 264.43,
        "target_3": 315.07,
        "stop_loss": 193.96,
        "add_level": 200.28
      },
      "range_3m": {
        "min": 115.1,
        "max": 213.8
      },
      "range_6m": {
        "min": 88.2,
        "max": 213.8
      },
      "explanation_short": "🟢 Günlük bazda ALIŞ sinyali veriyoruz. Alım sebepleri: HAFİF AL — Yükseliş trendi sürüyor ama momentum azalıyor. | AL — Tüm ortalamalar altında, mükemmel teknik görünüm. | AL — Altın kesişim aktif. Uz"
    },
    {
      "ticker": "ODAS",
      "name": "Odaş Elektrik",
      "sector": "Enerji",
      "price": 6.04,
      "change_pct": -5.625,
      "rsi": 51.3724,
      "stoch_k": 53.4091,
      "adx": 25.3319,
      "volume_ratio": 1.2,
      "signal": "HAFİF AL",
      "signal_en": "WEAK_BUY",
      "score": 23.4,
      "confidence": 65.4,
      "color": "#69f0ae",
      "targets": {
        "target_1": 6.21,
        "target_2": 6.57,
        "target_3": 6.73,
        "stop_loss": 5.97,
        "add_level": 6.01
      },
      "range_3m": {
        "min": 5.04,
        "max": 6.57
      },
      "range_6m": {
        "min": 4.97,
        "max": 6.57
      },
      "explanation_short": "🟢 Günlük bazda ALIŞ sinyali veriyoruz. Alım sebepleri: HAFİF AL — Yükseliş trendi sürüyor ama momentum azalıyor. | AL — Tüm ortalamalar altında, mükemmel teknik görünüm. | AL — Altın kesişim aktif. Uz"
    },
    {
      "ticker": "KCHOL",
      "name": "Koç Holding",
      "sector": "Holding",
      "price": 189.7,
      "change_pct": -2.4177,
      "rsi": 48.2026,
      "stoch_k": 47.9144,
      "adx": 25.1695,
      "volume_ratio": 0.5,
      "signal": "HAFİF AL",
      "signal_en": "WEAK_BUY",
      "score": 18.0,
      "confidence": 50.6,
      "color": "#69f0ae",
      "targets": {
        "target_1": 202.54,
        "target_2": 209.54,
        "target_3": 216.05,
        "stop_loss": 182.43,
        "add_level": 186.79
      },
      "range_3m": {
        "min": 172.93,
        "max": 220.84
      },
      "range_6m": {
        "min": 140.74,
        "max": 220.84
      },
      "explanation_short": "🟡 Günlük bazda BEKLEME sinyali veriyoruz. Göstergeler karışık sinyal üretiyor. \n\n📊 DESTEK & DİRENÇ SEVİYELERİ:\n  • Direnç 3: ₺263.96\n  • Direnç 2: ₺242.40\n  • Direnç 1: ₺216.05\n  • Pivot: ₺194.49\n  • "
    },
    {
      "ticker": "TAVHL",
      "name": "TAV Havalimanları",
      "sector": "Havacılık",
      "price": 314.0,
      "change_pct": -2.8616,
      "rsi": 52.7543,
      "stoch_k": 73.3607,
      "adx": 23.5936,
      "volume_ratio": 0.9,
      "signal": "HAFİF AL",
      "signal_en": "WEAK_BUY",
      "score": 17.4,
      "confidence": 68.5,
      "color": "#69f0ae",
      "targets": {
        "target_1": 330.9,
        "target_2": 345.46,
        "target_3": 365.58,
        "stop_loss": 306.09,
        "add_level": 310.84
      },
      "range_3m": {
        "min": 269.25,
        "max": 369.0
      },
      "range_6m": {
        "min": 217.6,
        "max": 369.0
      },
      "explanation_short": "🟡 Günlük bazda BEKLEME sinyali veriyoruz. Göstergeler karışık sinyal üretiyor. \n\n📊 DESTEK & DİRENÇ SEVİYELERİ:\n  • Direnç 3: ₺465.33\n  • Direnç 2: ₺417.17\n  • Direnç 1: ₺365.58\n  • Pivot: ₺317.42\n  • "
    },
    {
      "ticker": "EREGL",
      "name": "Ereğli Demir Çelik",
      "sector": "Metal",
      "price": 28.84,
      "change_pct": -4.0585,
      "rsi": 51.0226,
      "stoch_k": 57.8652,
      "adx": 29.697,
      "volume_ratio": 1.4,
      "signal": "HAFİF AL",
      "signal_en": "WEAK_BUY",
      "score": 13.8,
      "confidence": 43.9,
      "color": "#69f0ae",
      "targets": {
        "target_1": 29.72,
        "target_2": 30.87,
        "target_3": 32.72,
        "stop_loss": 28.69,
        "add_level": 28.7
      },
      "range_3m": {
        "min": 24.26,
        "max": 32.72
      },
      "range_6m": {
        "min": 23.46,
        "max": 32.72
      },
      "explanation_short": "🟡 Günlük bazda BEKLEME sinyali veriyoruz. Göstergeler karışık sinyal üretiyor. \n\n📊 DESTEK & DİRENÇ SEVİYELERİ:\n  • Direnç 3: ₺40.61\n  • Direnç 2: ₺36.67\n  • Direnç 1: ₺32.75\n  • Pivot: ₺28.81\n  • Dest"
    },
    {
      "ticker": "MAVI",
      "name": "Mavi Giyim",
      "sector": "Perakende",
      "price": 41.02,
      "change_pct": -2.6116,
      "rsi": 41.0594,
      "stoch_k": 1.1952,
      "adx": 15.6135,
      "volume_ratio": 1.1,
      "signal": "HAFİF AL",
      "signal_en": "WEAK_BUY",
      "score": 12.4,
      "confidence": 34.1,
      "color": "#69f0ae",
      "targets": {
        "target_1": 44.66,
        "target_2": 46.09,
        "target_3": 48.33,
        "stop_loss": 38.56,
        "add_level": 40.04
      },
      "range_3m": {
        "min": 38.56,
        "max": 50.75
      },
      "range_6m": {
        "min": 36.7,
        "max": 50.75
      },
      "explanation_short": "🟡 Günlük bazda BEKLEME sinyali veriyoruz. Göstergeler karışık sinyal üretiyor. \n\n📊 DESTEK & DİRENÇ SEVİYELERİ:\n  • Direnç 3: ₺60.52\n  • Direnç 2: ₺55.63\n  • Direnç 1: ₺48.33\n  • Pivot: ₺43.44\n  • Dest"
    },
    {
      "ticker": "EKGYO",
      "name": "Emlak Konut GYO",
      "sector": "GYO",
      "price": 19.23,
      "change_pct": -3.2209,
      "rsi": 36.8551,
      "stoch_k": 17.2897,
      "adx": 46.9471,
      "volume_ratio": 0.9,
      "signal": "BEKLE",
      "signal_en": "HOLD",
      "score": 11.9,
      "confidence": 25.5,
      "color": "#ffd740",
      "targets": {
        "target_1": 20.63,
        "target_2": 21.74,
        "target_3": 22.02,
        "stop_loss": 18.78,
        "add_level": 19.05
      },
      "range_3m": {
        "min": 18.86,
        "max": 27.12
      },
      "range_6m": {
        "min": 17.62,
        "max": 27.12
      },
      "explanation_short": "🟡 Günlük bazda BEKLEME sinyali veriyoruz. Göstergeler karışık sinyal üretiyor. \n\n📊 DESTEK & DİRENÇ SEVİYELERİ:\n  • Direnç 3: ₺32.87\n  • Direnç 2: ₺30.00\n  • Direnç 1: ₺24.61\n  • Pivot: ₺21.74\n  • Dest"
    },
    {
      "ticker": "ENJSA",
      "name": "Enerjisa",
      "sector": "Enerji",
      "price": 118.3,
      "change_pct": -1.0042,
      "rsi": 55.0087,
      "stoch_k": 49.6241,
      "adx": 23.9092,
      "volume_ratio": 0.6,
      "signal": "BEKLE",
      "signal_en": "HOLD",
      "score": 8.2,
      "confidence": 30.4,
      "color": "#ffd740",
      "targets": {
        "target_1": 125.0,
        "target_2": 131.13,
        "target_3": 143.97,
        "stop_loss": 117.03,
        "add_level": 117.73
      },
      "range_3m": {
        "min": 91.45,
        "max": 125.0
      },
      "range_6m": {
        "min": 72.45,
        "max": 125.0
      },
      "explanation_short": "🟡 Günlük bazda BEKLEME sinyali veriyoruz. Göstergeler karışık sinyal üretiyor. \n\n📊 DESTEK & DİRENÇ SEVİYELERİ:\n  • Direnç 3: ₺162.93\n  • Direnç 2: ₺143.97\n  • Direnç 1: ₺131.13\n  • Pivot: ₺112.17\n  • "
    },
    {
      "ticker": "PETKM",
      "name": "Petkim",
      "sector": "Kimya",
      "price": 21.8,
      "change_pct": 4.5062,
      "rsi": 65.2113,
      "stoch_k": 85.3932,
      "adx": 59.9996,
      "volume_ratio": 0.9,
      "signal": "BEKLE",
      "signal_en": "HOLD",
      "score": 7.9,
      "confidence": 15.2,
      "color": "#ffd740",
      "targets": {
        "target_1": 23.91,
        "target_2": 26.03,
        "target_3": 29.73,
        "stop_loss": 20.86,
        "add_level": 21.43
      },
      "range_3m": {
        "min": 16.41,
        "max": 22.32
      },
      "range_6m": {
        "min": 16.12,
        "max": 22.32
      },
      "explanation_short": "🟡 Günlük bazda BEKLEME sinyali veriyoruz. Göstergeler karışık sinyal üretiyor. \n\n📊 DESTEK & DİRENÇ SEVİYELERİ:\n  • Direnç 3: ₺29.73\n  • Direnç 2: ₺26.03\n  • Direnç 1: ₺23.91\n  • Pivot: ₺20.21\n  • Dest"
    },
    {
      "ticker": "TUPRS",
      "name": "Tüpraş",
      "sector": "Enerji",
      "price": 259.0,
      "change_pct": 0.9747,
      "rsi": 62.4177,
      "stoch_k": 78.7402,
      "adx": 31.5967,
      "volume_ratio": 0.9,
      "signal": "BEKLE",
      "signal_en": "HOLD",
      "score": 7.7,
      "confidence": 21.7,
      "color": "#ffd740",
      "targets": {
        "target_1": 285.19,
        "target_2": 311.37,
        "target_3": 356.41,
        "stop_loss": 248.48,